{
  "unique_id": "hf_meta-llama_Llama-Guard-3-1B",
  "name": "meta-llama/Llama-Guard-3-1B",
  "parameters": "Unknown",
  "license": "Unknown",
  "context_window": 0,
  "source_url": "https://huggingface.co/meta-llama/Llama-Guard-3-1B",
  "source_name": "Hugging Face",
  "source_type": "huggingface",
  "category": "text-generation",
  "schema_version": "1.0",
  "retrieval_timestamp": "2026-06-14T13:52:09Z",
  "last_updated": "2026-06-14T13:52:09Z",
  "raw_payload": {}
}